{
  "$schema": "../schemas/scientific_figure_workflow.v1.schema.json",
  "schema_version": "scientific_figure_workflow.v1",
  "updated_at": "2026-05-27",
  "policy": "本地科研绘图吸收 scientific-figure-skill 的规范性内容，但不新增重复主 skill、不整包安装外部仓库。真实数据图表由 figure-table-studio 负责，机制图、概念图、流程图和 image2 结构图由 research-figure-studio 负责；共同遵守本合同的数据体检、过程数据留痕、统计标注、图注、导出和风险边界。",
  "source_review_refs": [
    {
      "upstream": "myzhao0114-del/scientific-figure-skill",
      "repo_url": "https://github.com/myzhao0114-del/scientific-figure-skill",
      "adopted_as": [
        "configuration_block_first",
        "data_health_before_plotting",
        "process_data_traceability",
        "justified_statistics_annotations",
        "caption_what_how_so_what",
        "multi_format_export"
      ]
    },
    {
      "upstream": "Yuan1z0825/nature-skills",
      "repo_url": "https://github.com/Yuan1z0825/nature-skills",
      "adopted_as": [
        "figure_claim_contract",
        "visual_argument_hierarchy",
        "editable_publication_outputs",
        "review_ready_caption_and_notes"
      ]
    },
    {
      "upstream": "Jinze-Lee/codex-skills-workbench",
      "repo_url": "https://github.com/Jinze-Lee/codex-skills-workbench",
      "adopted_as": [
        "plotting_tool_selection_by_deliverable",
        "r_scatter_plot_output_bundle",
        "raincloud_distribution_plot_adapter",
        "weighted_regression_plot_interpretation_check",
        "ggplot2_richtext_export_diagnostics"
      ]
    },
    {
      "upstream": "Leey21/awesome-ai-research-writing",
      "repo_url": "https://github.com/Leey21/awesome-ai-research-writing",
      "adopted_as": [
        "architecture_figure_prompt_constraints",
        "chart_type_recommendation_by_evidence_task",
        "figure_title_plainness",
        "table_title_plainness",
        "data_bound_result_analysis"
      ]
    }
  ],
  "adoption_options": [
    {
      "id": "option_a_install_upstream_skill",
      "label": "直接安装外部 scientific-figure skill",
      "decision": "reject_as_default",
      "description": "把外部仓库克隆到 Codex skills 目录并让它成为独立技能。",
      "strengths": [
        "上线最快",
        "保留原作者完整提示词和参考文件",
        "适合一次性试用"
      ],
      "risks": [
        "与本地 research-figure-studio 和 figure-table-studio 重复",
        "会绕开本地质量门和社科出版风格合同",
        "外部 agents/openai.yaml 的隐式触发可能改变本地路由",
        "无法统一约束 image2 与真实数据图边界"
      ]
    },
    {
      "id": "option_b_text_only_absorption",
      "label": "只把规则写进现有 skill 文本",
      "decision": "reject_as_default",
      "description": "把数据体检、字体、配色、图注等文字规则追加到本地绘图 skill。",
      "strengths": [
        "改动小",
        "不会增加命令或 schema",
        "能快速改善提示词"
      ],
      "risks": [
        "不同线程执行尺度仍不一致",
        "无法检查质量门是否覆盖关键规范",
        "后续演化时容易和 publication_style_rules 脱节"
      ]
    },
    {
      "id": "option_c_contract_first_integration",
      "label": "合同先行并入现有绘图链",
      "decision": "selected",
      "description": "新增 scientific_figure_workflow schema/catalog/validator，把外部仓库的规范性内容并入 research-figure-studio、figure-table-studio 和 publication_style_rules。",
      "strengths": [
        "保留现有总路由和 image2 规则",
        "真实数据图与概念机制图边界清楚",
        "数据体检、过程数据、统计标注、图注和导出格式可被 validator 检查",
        "适合后续加入更多期刊风格预设"
      ],
      "risks": [
        "需要维护一个新合同和 validator",
        "正式数据图会比临时出图多一步数据体检",
        "某些外部默认如四边框需要按社科期刊风格条件化"
      ]
    },
    {
      "id": "option_d_new_local_scientific_figure_skill",
      "label": "新建本地 scientific-figure skill",
      "decision": "watch",
      "description": "在本地新增一个独立 skill，专门处理 Excel/CSV 到科研图和报告。",
      "strengths": [
        "用户意图直观",
        "可以完整保留表格数据出图流程",
        "适合未来把统计图生成做成独立产品化能力"
      ],
      "risks": [
        "与 figure-table-studio 高度重叠",
        "增加路由歧义",
        "需要重新处理论文图、数据图、image2 图之间的边界"
      ]
    },
    {
      "id": "option_e_runtime_prompt_only",
      "label": "只保留成运行态提示模板",
      "decision": "reject_as_default",
      "description": "不改本地仓，只在对话里提示画图时参考该仓库风格。",
      "strengths": [
        "零代码变更",
        "适合一次性实验"
      ],
      "risks": [
        "不能解决用户反馈的随机性问题",
        "无法进入 daily audit 或质量门",
        "不能约束后续线程"
      ]
    }
  ],
  "selected_strategy": "option_c_contract_first_integration",
  "workflow_modes": [
    {
      "id": "empirical_tabular_figure",
      "label": "结构化数据科研图",
      "owner_skill": "figure-table-studio",
      "trigger_signals": [
        "Excel 出图",
        "CSV 画图",
        "回归图",
        "箱线图",
        "柱状图加显著性",
        "趋势图",
        "统计图",
        "论文结果图"
      ],
      "required_steps": [
        "configuration_block",
        "isolated_output_directory",
        "data_health_report",
        "process_data_export",
        "justified_statistics",
        "publication_rendering",
        "caption_contract",
        "delivery_summary"
      ],
      "renderer_policy": "真实数据图、统计图、模型输出图和表格默认使用确定性代码或可编辑工具，image2 只能辅助布局，不能生成数值、坐标、误差线或显著性。",
      "outputs": [
        "00_data_health.md",
        "figures/pdf",
        "figures/png",
        "figures/jpg",
        "process_data",
        "caption_or_figure_note"
      ]
    },
    {
      "id": "conceptual_mechanism_figure",
      "label": "概念机制与流程图",
      "owner_skill": "research-figure-studio",
      "trigger_signals": [
        "机制图",
        "概念框架图",
        "流程图",
        "研究设计图",
        "理论图",
        "image2 科研图"
      ],
      "required_steps": [
        "figure_brief",
        "publication_rendering",
        "caption_contract",
        "delivery_summary"
      ],
      "renderer_policy": "概念图、机制图和流程图可使用 image2，但必须先锁定面板、文字、箭头、配色和禁止编造项；文字错误必须用可编辑工具修正。",
      "outputs": [
        "final_figure",
        "editable_source_when_possible",
        "figure_brief",
        "caption_or_figure_note",
        "audit_checklist"
      ]
    },
    {
      "id": "mixed_paper_figure_set",
      "label": "论文图组",
      "owner_skill": "research-figure-studio + figure-table-studio",
      "trigger_signals": [
        "论文图组",
        "多面板图",
        "投稿图表",
        "送审图表",
        "顶刊图表"
      ],
      "required_steps": [
        "figure_brief",
        "configuration_block",
        "isolated_output_directory",
        "data_health_report",
        "process_data_export",
        "justified_statistics",
        "publication_rendering",
        "caption_contract",
        "report_bundle",
        "delivery_summary"
      ],
      "renderer_policy": "先由 research-figure-studio 锁定图组论证功能和面板层级，再由 figure-table-studio 处理经验数据面板；概念面板可 image2，数据面板必须确定性渲染。",
      "outputs": [
        "figure_brief",
        "00_data_health.md",
        "process_data",
        "multi_format_figures",
        "caption_set",
        "figure_audit_report"
      ]
    },
    {
      "id": "quick_discussion_figure",
      "label": "讨论草图",
      "owner_skill": "research-figure-studio",
      "trigger_signals": [
        "草图",
        "先画个示意",
        "快速看看",
        "讨论用图"
      ],
      "required_steps": [
        "figure_brief",
        "publication_rendering",
        "delivery_summary"
      ],
      "renderer_policy": "可放宽完整报告要求，但必须说明假设、不得制造经验数值，后续进入论文或投稿时必须升级为正式模式。",
      "outputs": [
        "preview_figure",
        "assumptions"
      ]
    }
  ],
  "workflow_steps": [
    {
      "id": "figure_brief",
      "label": "图形说明卡",
      "requirement": "渲染前锁定图的用途、论文主张、图型、数据或概念依据、面板计划、文字、箭头、配色、渲染器和风险检查。",
      "applies_to_modes": [
        "conceptual_mechanism_figure",
        "mixed_paper_figure_set",
        "quick_discussion_figure"
      ],
      "outputs": [
        "figure_brief"
      ],
      "blockers": [
        "图的主张不明",
        "箭头或面板关系没有含义",
        "图会暗示未经证实的因果或经验结论"
      ]
    },
    {
      "id": "configuration_block",
      "label": "脚本配置前置",
      "requirement": "正式数据绘图脚本必须在顶部集中声明输入路径、输出目录、字体 fallback、输出格式、显著性阈值、误差线类型、数字精度和图尺寸。",
      "applies_to_modes": [
        "empirical_tabular_figure",
        "mixed_paper_figure_set"
      ],
      "outputs": [
        "analysis_script_config"
      ],
      "blockers": [
        "路径、字体、显著性阈值或导出格式散落在脚本各处",
        "输出目录与原始数据目录相同且未说明风险"
      ]
    },
    {
      "id": "isolated_output_directory",
      "label": "独立输出目录",
      "requirement": "正式绘图输出默认写入项目 outputs 下的专门目录，并包含 figures 和 process_data 子目录，不写回原始数据目录。",
      "applies_to_modes": [
        "empirical_tabular_figure",
        "mixed_paper_figure_set"
      ],
      "outputs": [
        "output_directory",
        "figures_directory",
        "process_data_directory"
      ],
      "blockers": [
        "会覆盖原始数据",
        "输出目录不可追踪",
        "图件和过程数据混在同一层"
      ]
    },
    {
      "id": "data_health_report",
      "label": "绘图前数据体检",
      "requirement": "从 Excel/CSV 等结构化数据生成正式图表前，先检查行列、类型、缺失、重复、描述统计、异常值、分布和必要时的相关/VIF。",
      "applies_to_modes": [
        "empirical_tabular_figure",
        "mixed_paper_figure_set"
      ],
      "outputs": [
        "00_data_health.md"
      ],
      "blockers": [
        "关键变量缺失率过高却继续画图",
        "回归或模型任务存在严重共线性却未声明",
        "样本量不足却生成统计显著性判断"
      ]
    },
    {
      "id": "process_data_export",
      "label": "过程数据留痕",
      "requirement": "保存原始读取、清洗后、聚合后、统计检验和每张图对应的数据 sidecar，让图中每个数字都能追溯到文件、sheet 和列。",
      "applies_to_modes": [
        "empirical_tabular_figure",
        "mixed_paper_figure_set"
      ],
      "outputs": [
        "process_data/01_raw_loaded.xlsx",
        "process_data/02_cleaned.xlsx",
        "process_data/fig_NN_data.xlsx"
      ],
      "blockers": [
        "无法解释图中数字来源",
        "清洗或聚合过程没有留档",
        "统计结果只写在图上没有原始检验表"
      ]
    },
    {
      "id": "justified_statistics",
      "label": "统计标注有依据",
      "requirement": "只有真实组间比较或明确设计需要时才运行显著性检验；误差条、置信区间、p 值、星号和 ns 必须说明测试方法和样本含义。",
      "applies_to_modes": [
        "empirical_tabular_figure",
        "mixed_paper_figure_set"
      ],
      "outputs": [
        "process_data/05_statistical_tests.xlsx",
        "statistics_note"
      ],
      "blockers": [
        "趋势图、散点图或单分布图被随意加 p 值",
        "paired 与 independent 样本不明却直接选检验",
        "p 值被写成 0.0000",
        "误差条没有说明 SD、SEM 或 95% CI"